{"instruction":"Return the fixed provider-free abstention using the supplied closed schema.","payloads":[{"byte_length":80,"encoding":"utf-8","media_type":"text/x-rust; charset=utf-8","payload_id":"source-payload:sha256:1a57f85f84057497e41d6bbce57b9b65317cf734655cdfcbdedd837c37a6d180","sha256":"sha256:bb4703559ea6864e9241b2e5443e9920d421185c5d742bcfe97c2d762a288d15","text":"//! Experimental resource reservation, allocation, and reconciliation protocol.\n"},{"byte_length":352,"encoding":"utf-8","media_type":"text/x-rust; charset=utf-8","payload_id":"source-payload:sha256:2ca7b3b0841e608e77fe49767503d558c56e20b81de1c95bdf8e9cef6b802e3b","sha256":"sha256:847baecb6414ce98861cc0d61c78107bea07e24622c642cce5c7a47c225fb70e","text":"#[derive(Clone, Debug, Deserialize, Eq, PartialEq, Serialize)]\n#[serde(deny_unknown_fields)]\npub struct ResourceDeclaration {\n    pub schema: String,\n    pub schema_version: u32,\n    pub declaration_id: String,\n    pub runtime_graph_id: String,\n    pub runtime_graph_content_hash: String,\n    pub node_id: String,\n    pub claims: Vec<ResourceClaim>,\n}\n"},{"byte_length":1067,"encoding":"utf-8","media_type":"text/x-rust; charset=utf-8","payload_id":"source-payload:sha256:33b11600b1ed43fc53b6c2f56931b0277028be4373c1eed871119057080ad2e0","sha256":"sha256:1aac82c27b62051d9713dbf107ecd644b03d337af5a35794dc654ec2ac374cee","text":"/// Grants a reservation only after the declaration is joined to the exact\n/// content-addressed topology node and its complete resource-claim set.\n///\n/// Runtime adapters should use this entry point. [`grant_reservation`] remains\n/// the protocol-level compatibility evaluator for already joined declarations.\npub fn grant_topology_reservation(\n    topology: &ExecutionTopology,\n    declaration: &ResourceDeclaration,\n    candidate: &ResourceReservation,\n    existing: &[ResourceReservation],\n    assertions: &[ReservationDispositionAssertion],\n    capacities: &[RateLimitCapacity],\n) -> Result<ResourceReservation, Vec<ResourceProtocolFinding>> {\n    let mut findings = validate_resource_declaration(topology, declaration);\n    if let Err(mut grant_findings) =\n        grant_reservation(declaration, candidate, existing, assertions, capacities)\n    {\n        findings.append(&mut grant_findings);\n    }\n    findings.sort_by(finding_order);\n    findings.dedup();\n    if findings.is_empty() {\n        Ok(candidate.clone())\n    } else {\n        Err(findings)\n    }\n}\n"},{"byte_length":1958,"encoding":"utf-8","media_type":"text/x-rust; charset=utf-8","payload_id":"source-payload:sha256:d4bd03855d392dd86fd9a55f439099b540f430b01e7b01469c63314757b9d617","sha256":"sha256:1ed9cff10bc73f7c354827e72ae5ea11d4dbc584811c196bbb6d692fb8e7250c","text":"/// Validates the declaration/topology join without granting or reserving.\npub fn validate_resource_declaration(\n    topology: &ExecutionTopology,\n    declaration: &ResourceDeclaration,\n) -> Vec<ResourceProtocolFinding> {\n    let mut findings = validate_declaration_record(declaration, None);\n    let topology_hash = execution_topology_content_hash(topology)\n        .expect(\"typed execution topology serializes deterministically\");\n    if declaration.runtime_graph_id != topology.topology_id\n        || declaration.runtime_graph_content_hash != topology_hash\n    {\n        findings.push(finding(\n            \"declaration_graph_join_mismatch\",\n            None,\n            None,\n            None,\n            \"declaration must join the exact topology id and content hash\",\n        ));\n    }\n    match topology\n        .nodes\n        .iter()\n        .find(|node| node.node_id == declaration.node_id)\n    {\n        None => findings.push(finding(\n            \"unknown_declaration_node\",\n            None,\n            None,\n            None,\n            \"declaration node_id does not exist in the topology\",\n        )),\n        Some(node) => {\n            let declared = declaration.claims.iter().cloned().collect::<BTreeSet<_>>();\n            let expected = node\n                .resource_claims\n                .iter()\n                .cloned()\n                .collect::<BTreeSet<_>>();\n            if declared != expected\n                || declared.len() != declaration.claims.len()\n                || expected.len() != node.resource_claims.len()\n            {\n                findings.push(finding(\n                    \"declaration_topology_claim_mismatch\",\n                    None,\n                    None,\n                    None,\n                    \"declaration claims must exactly equal the topology node resource claims\",\n                ));\n            }\n        }\n    }\n    findings.sort_by(finding_order);\n    findings.dedup();\n    findings\n}\n"}],"response_schema":{"$schema":"https://json-schema.org/draft/2020-12/schema","additionalProperties":false,"properties":{"disposition":{"additionalProperties":false,"properties":{"detail":{"const":"deterministic.abstain@1 does not evaluate semantic properties"},"kind":{"const":"abstention"},"reason":{"const":"required_evidence_unavailable"}},"required":["kind","reason","detail"],"type":"object"},"schema":{"const":"provider-free.source-grounded-abstention@1"},"source_inventory_id":{"const":"source-inventory:sha256:86fbe29ca8f5b6fd4799bbea05faef749c8564f74492edd3f6f4eca9d18fd98f"},"task_id":{"const":"provider-free-review-task:sha256:b2d0a779522a6a1647c297ca6f9e4bc98dfa9bfcf0bbe58909dbda6d9a2c872f"}},"required":["schema","task_id","source_inventory_id","disposition"],"type":"object"},"schema":"provider-free.source-grounded-packet@1","source_inventory":{"admitted_sources":[{"bytes":80,"path":"src/resource_protocol.rs","payload_id":"source-payload:sha256:1a57f85f84057497e41d6bbce57b9b65317cf734655cdfcbdedd837c37a6d180","range":{"end_line":1,"start_line":1},"sha256":"sha256:bb4703559ea6864e9241b2e5443e9920d421185c5d742bcfe97c2d762a288d15","source_id":"source:sha256:55ec29b90392e10d1ce0cbafa0971601353b45817dc8fc270f8d844b58285a71"},{"bytes":352,"path":"src/resource_protocol.rs","payload_id":"source-payload:sha256:2ca7b3b0841e608e77fe49767503d558c56e20b81de1c95bdf8e9cef6b802e3b","range":{"end_line":39,"start_line":29},"sha256":"sha256:847baecb6414ce98861cc0d61c78107bea07e24622c642cce5c7a47c225fb70e","source_id":"source:sha256:850b3d498ccdcaacca843271c5a9d6d1ab252ee0719baa436d61445fd0b86f19"},{"bytes":1958,"path":"src/resource_protocol.rs","payload_id":"source-payload:sha256:d4bd03855d392dd86fd9a55f439099b540f430b01e7b01469c63314757b9d617","range":{"end_line":429,"start_line":374},"sha256":"sha256:1ed9cff10bc73f7c354827e72ae5ea11d4dbc584811c196bbb6d692fb8e7250c","source_id":"source:sha256:8da7d31578b14f527ffbfad1661be2d6ec3ebefd7bdc35eedd7e8676e5907298"},{"bytes":1067,"path":"src/resource_protocol.rs","payload_id":"source-payload:sha256:33b11600b1ed43fc53b6c2f56931b0277028be4373c1eed871119057080ad2e0","range":{"end_line":372,"start_line":346},"sha256":"sha256:1aac82c27b62051d9713dbf107ecd644b03d337af5a35794dc654ec2ac374cee","source_id":"source:sha256:bdacb2fa701b6eecb20d11a1eed7f1ccec013c0e59abf537987f98b0f6449164"}],"canonical_sha256":"sha256:86fbe29ca8f5b6fd4799bbea05faef749c8564f74492edd3f6f4eca9d18fd98f","schema":"provider-free.source-inventory@1","source_inventory_id":"source-inventory:sha256:86fbe29ca8f5b6fd4799bbea05faef749c8564f74492edd3f6f4eca9d18fd98f"},"task_id":"provider-free-review-task:sha256:b2d0a779522a6a1647c297ca6f9e4bc98dfa9bfcf0bbe58909dbda6d9a2c872f"}