{"instruction":"Return the fixed provider-free abstention using the supplied closed schema.","payloads":[{"byte_length":271,"encoding":"utf-8","media_type":"text/x-rust; charset=utf-8","payload_id":"source-payload:sha256:0ed8cc2496c19fac17382750a7df892ec8c95334e3eb71c01a4e5a018b60cd5a","sha256":"sha256:61a44961601ae03d914173656cfb4efa3b03792a1260d113addd59a124975ba8","text":"#[derive(Clone, Copy, Debug, Deserialize, Eq, Hash, Ord, PartialEq, PartialOrd, Serialize)]\n#[serde(rename_all = \"snake_case\")]\npub enum NativeReviewTargetKind {\n    Completion,\n    Evidence,\n    ExecutionTopology,\n    Morphism,\n    Plan,\n    ResidualRisk,\n    Waiver,\n}\n"},{"byte_length":1742,"encoding":"utf-8","media_type":"text/x-rust; charset=utf-8","payload_id":"source-payload:sha256:59cc710cf9f058a394011925b792cf4dee78b35f5148e88ca6eda8d3b3fddf75","sha256":"sha256:ca78d3b79fe105c48d008afc2f141082c95071e4290750bc2bdf3f9793b2b1e5","text":"pub fn check_operation_gate(\n    case_space: &CaseSpace,\n    gate: &NativeOperationGate,\n    expected_operation: &str,\n) -> Result<(), NativeOperationGateError> {\n    let failures = operation_gate_failures(case_space, gate, expected_operation);\n    if failures.is_empty() {\n        return Ok(());\n    }\n    let witness_ids = failures\n        .iter()\n        .flat_map(|failure| failure.witness_ids.iter().cloned())\n        .collect();\n    let labels = failures\n        .iter()\n        .map(|failure| failure.message.as_str())\n        .collect::<Vec<_>>()\n        .join(\"; \");\n    // All or nothing. `operation_gate_failures` does not short-circuit, so a\n    // wrong scope and an unauthorized capability can refuse together — and\n    // the recovery for the two is opposite: copy a value and retry, versus\n    // stop and escalate to someone holding the capability. Reporting the\n    // mismatch alone in that mixed case would tell a caller its authority\n    // was never evaluated when it was evaluated and denied, and on\n    // `plan accept` that is the always-human checkpoint in\n    // `docs/security/worker-execution-policy.md` being read as a retry loop.\n    // So this field means \"the whole refusal is mechanical\", not \"part of it\n    // was\"; anything else and the caller must read `message`.\n    let mismatches = failures\n        .iter()\n        .filter_map(|failure| failure.mismatch.clone())\n        .collect::<Vec<_>>();\n    let field_mismatches = if mismatches.len() == failures.len() {\n        mismatches\n    } else {\n        Vec::new()\n    };\n    Err(NativeOperationGateError {\n        message: format!(\"operation gate for {expected_operation:?} violates: {labels}\"),\n        witness_ids,\n        field_mismatches,\n    })\n}\n"},{"byte_length":1317,"encoding":"utf-8","media_type":"text/x-rust; charset=utf-8","payload_id":"source-payload:sha256:c07aff90638fe0d65c5fc02adae428133c7f48c8062f492699bd0f75c9d77986","sha256":"sha256:782b4cba77f47c66720067f6c3f20e525718f77e218e5dc4d3c128b25289c8d8","text":"fn policy_capability_gate_invariant(\n    case_space: &CaseSpace,\n    request: &NativeCloseCheckRequest,\n) -> NativeCloseInvariantResult {\n    let has_close_policy =\n        request.close_policy_id.is_some() || case_space.close_policy_id.is_some();\n    let has_operation_source = !request.source_ids.is_empty();\n    let mut witness_ids = Vec::new();\n    if !has_close_policy {\n        witness_ids.push(case_space.case_space_id.clone());\n    }\n    if !has_operation_source {\n        witness_ids.push(case_space.revision.revision_id.clone());\n    }\n    let Some(gate) = &request.operation_gate else {\n        witness_ids.push(case_space.case_space_id.clone());\n        return close_invariant(\n            \"close:native-policy-capability-gate\",\n            dedupe_ids(witness_ids),\n            \"Close checks must include an operation gate with actor, capability, scope, audience, and source boundary.\",\n        );\n    };\n    if let Err(error) = check_operation_gate(case_space, gate, \"close-check\") {\n        witness_ids.extend(error.witness_ids);\n    }\n    close_invariant(\n        \"close:native-policy-capability-gate\",\n        dedupe_ids(witness_ids),\n        \"Close checks must name a close policy, source evidence, and a matching operation gate for actor, capability, scope, audience, and source boundary.\",\n    )\n}\n"},{"byte_length":13,"encoding":"utf-8","media_type":"text/x-rust; charset=utf-8","payload_id":"source-payload:sha256:fabb6dbe6288052672f261affe24af498321b232c3b5638757f51f4d735f09f5","sha256":"sha256:092df582be6223927e97ffe4a360667f62cb497f058abc8392a34b0045b0a305","text":"use crate::{\n"}],"response_schema":{"$schema":"https://json-schema.org/draft/2020-12/schema","additionalProperties":false,"properties":{"disposition":{"additionalProperties":false,"properties":{"detail":{"const":"deterministic.abstain@1 does not evaluate semantic properties"},"kind":{"const":"abstention"},"reason":{"const":"required_evidence_unavailable"}},"required":["kind","reason","detail"],"type":"object"},"schema":{"const":"provider-free.source-grounded-abstention@1"},"source_inventory_id":{"const":"source-inventory:sha256:3a925d9985320f517384d9b0297ced24284a465f4a3b6b3dfaa6c67e6738de76"},"task_id":{"const":"provider-free-review-task:sha256:7a6e45cf5b31e9a2737c7365112d072fca9153f32a65082a7a06feed08fa0ef7"}},"required":["schema","task_id","source_inventory_id","disposition"],"type":"object"},"schema":"provider-free.source-grounded-packet@1","source_inventory":{"admitted_sources":[{"bytes":13,"path":"src/native_review.rs","payload_id":"source-payload:sha256:fabb6dbe6288052672f261affe24af498321b232c3b5638757f51f4d735f09f5","range":{"end_line":1,"start_line":1},"sha256":"sha256:092df582be6223927e97ffe4a360667f62cb497f058abc8392a34b0045b0a305","source_id":"source:sha256:0a805577da8eda3a79868634c2bc11c09cc37a2e1bb5bdd35161678ee626e449"},{"bytes":271,"path":"src/native_review.rs","payload_id":"source-payload:sha256:0ed8cc2496c19fac17382750a7df892ec8c95334e3eb71c01a4e5a018b60cd5a","range":{"end_line":36,"start_line":26},"sha256":"sha256:61a44961601ae03d914173656cfb4efa3b03792a1260d113addd59a124975ba8","source_id":"source:sha256:14071e2cc388059fafd7cec661339a4d532ab342e96bd058271fd8840fe76a43"},{"bytes":1742,"path":"src/native_review.rs","payload_id":"source-payload:sha256:59cc710cf9f058a394011925b792cf4dee78b35f5148e88ca6eda8d3b3fddf75","range":{"end_line":478,"start_line":436},"sha256":"sha256:ca78d3b79fe105c48d008afc2f141082c95071e4290750bc2bdf3f9793b2b1e5","source_id":"source:sha256:468fe78cf1bf45093820c876f8dd11c052dd9d704658b63cd268a467f88d84c3"},{"bytes":1317,"path":"src/native_review.rs","payload_id":"source-payload:sha256:c07aff90638fe0d65c5fc02adae428133c7f48c8062f492699bd0f75c9d77986","range":{"end_line":852,"start_line":822},"sha256":"sha256:782b4cba77f47c66720067f6c3f20e525718f77e218e5dc4d3c128b25289c8d8","source_id":"source:sha256:72d2fbe782278357e56320e49b89cf01d97203d13322509eb4b1451f92287266"}],"canonical_sha256":"sha256:3a925d9985320f517384d9b0297ced24284a465f4a3b6b3dfaa6c67e6738de76","schema":"provider-free.source-inventory@1","source_inventory_id":"source-inventory:sha256:3a925d9985320f517384d9b0297ced24284a465f4a3b6b3dfaa6c67e6738de76"},"task_id":"provider-free-review-task:sha256:7a6e45cf5b31e9a2737c7365112d072fca9153f32a65082a7a06feed08fa0ef7"}